{
  "$schema": "../../../contracts/course/course.schema.json",
  "slug": "engenharia-de-ia",
  "title": "Engenharia de IA",
  "tagline": "Dos fundamentos dos modelos à arquitetura de sistemas em produção.",
  "description": "Para devs que querem se tornar engenheiros de IA. Cada módulo tem aulas com exercício, exercícios de fixação e um projeto prático sobre um caso de estudo. O curso termina com um projeto de conclusão que junta tudo num sistema completo. Todos os projetos rodam na sua máquina, com modelos abertos e sem custo, e quem não tem um computador potente pode usar a API da DeepSeek, que custa pouco.",
  "level": "Intermediário",
  "audience": "Devs que já programam e querem trabalhar com IA",
  "version": "1.0.0",
  "updatedAt": "2026-10-26",
  "rhythm": {
    "weekdayHours": 1,
    "saturdayHours": 3,
    "sundayHours": 1
  },
  "kickoff": {
    "title": "Início do curso: monte sua rotina",
    "detail": "Instale Docker, Python com uv e Ollama, baixe um modelo pequeno, crie o repositório de estudos e reserve na agenda os horários: 1 h de segunda a sexta, 3 h no sábado e 1 h no domingo."
  },
  "sundayTrack": {
    "moduleId": "m9",
    "rotation": [
      {
        "title": "Leitura de paper",
        "detail": "Leia um paper ligado ao módulo atual (veja o material de apoio) e escreva um resumo de um parágrafo no caderno de carreira."
      },
      {
        "title": "Escrita técnica",
        "detail": "Rascunhe um post ou artigo curto sobre o que você construiu nas últimas semanas."
      },
      {
        "title": "Leitura de paper",
        "detail": "Leia um paper ligado ao módulo atual (veja o material de apoio) e escreva um resumo de um parágrafo no caderno de carreira."
      },
      {
        "title": "Modelos de ponta",
        "detail": "Atualize sua tabela de modelos com lançamentos, preços e tamanho de contexto."
      }
    ],
    "milestones": [
      {
        "sunday": 6,
        "title": "Portfólio público: organize os repositórios",
        "detail": "Publique os projetos dos módulos com README, prints, vídeo curto e resultados.",
        "lessonIndex": 0
      },
      {
        "sunday": 16,
        "title": "IA no trabalho",
        "detail": "Proponha ao seu time um uso concreto de IA, com custo e riscos estimados.",
        "lessonIndex": 6
      },
      {
        "sunday": 24,
        "title": "Open source: escolha um projeto",
        "detail": "Procure uma issue para iniciantes num projeto de IA que você usa. Tenha uma contribuição aceita num projeto de IA.",
        "lessonIndex": 4
      },
      {
        "sunday": -3,
        "title": "Estudo de caso",
        "detail": "Escreva o estudo de caso do projeto de conclusão, com arquitetura, desempenho e notas de avaliação.",
        "lessonIndex": 1
      },
      {
        "sunday": -1,
        "title": "Retrospectiva do curso",
        "detail": "Revise o portfólio, atualize currículo e LinkedIn e escreva o que faria diferente no próximo ciclo."
      }
    ]
  },
  "modules": [
    {
      "id": "m1",
      "shortTitle": "Fundamentos de LLM",
      "title": "Fundamentos de LLM",
      "kind": "standard",
      "months": 2,
      "prerequisite": "Programação em qualquer linguagem e noções de Git. Python básico ajuda, mas a primeira aula cobre o necessário.",
      "goal": "Ganhar a intuição que separa quem usa LLM de quem sabe depurar um: como o texto vira vetor, como o modelo escolhe a próxima palavra e por que ele erra.",
      "caseStudy": "Um corpus em português de domínio público, como a obra de Machado de Assis, para treinar e inspecionar um modelo pequeno.",
      "lowSpecTip": "Faça as chamadas de modelo (aulas 1.2 e 1.8) pela API da DeepSeek e use um modelo de embedding pequeno na CPU. Treine o Mini GPT na GPU gratuita do Google Colab.",
      "lessons": [
        {
          "title": "Python para devs",
          "summary": "Tipagem, async, pydantic, pytest e ambientes com uv.",
          "exercise": "Escreva um script que lê um CSV de mensagens de clientes, valida cada linha com pydantic e tem testes com pytest."
        },
        {
          "title": "Ambiente local de IA",
          "summary": "Ollama, modelos abertos, quantização básica, a API local compatível com OpenAI e a DeepSeek como alternativa barata.",
          "exercise": "Instale o Ollama, baixe um modelo de 3B e outro de 7 a 8B e chame os dois pela API local num script. Sem GPU, chame um modelo de 1 a 3B local e o deepseek-flash pela mesma biblioteca."
        },
        {
          "title": "Vetores e similaridade",
          "summary": "Vetores, produto escalar, norma e similaridade de cosseno.",
          "exercise": "Gere embeddings de 20 frases sobre atendimento com um modelo local e encontre os pares mais parecidos calculando o cosseno à mão."
        },
        {
          "title": "Probabilidade e amostragem",
          "summary": "Distribuições, softmax, temperatura e top-p.",
          "exercise": "Implemente softmax com temperatura e top-p em NumPy e amostre mil vezes para ver a distribuição mudar."
        },
        {
          "title": "Gradiente e treino",
          "summary": "Derivada, regra da cadeia e gradiente descendente.",
          "exercise": "Construa o micrograd acompanhando a primeira aula do Karpathy."
        },
        {
          "title": "PyTorch e GPU",
          "summary": "Tensores, autograd, loop de treino e uso da GPU local ou do Google Colab gratuito.",
          "exercise": "Treine uma rede pequena no MNIST e compare o tempo na CPU e na GPU."
        },
        {
          "title": "Transformers por dentro",
          "summary": "Tokenização, embeddings e atenção.",
          "exercise": "Conte os tokens do mesmo texto em português e em inglês em dois tokenizadores do Hugging Face e explique a diferença."
        },
        {
          "title": "Por que o modelo erra",
          "summary": "Pré-treino, pós-treino, alucinação e limites do contexto.",
          "exercise": "Faça 20 perguntas difíceis a um modelo local, registre as respostas erradas e classifique a causa de cada uma."
        }
      ],
      "drills": [
        {
          "title": "Similaridade sem biblioteca",
          "task": "Implemente busca por similaridade de cosseno em 200 frases usando só NumPy e compare com uma biblioteca pronta."
        },
        {
          "title": "Temperatura na prática",
          "task": "Gere 10 respostas para o mesmo prompt em três temperaturas, num modelo local, e descreva o que mudou em variedade e acerto."
        },
        {
          "title": "Gradiente à mão",
          "task": "Calcule no papel o gradiente de uma rede de duas camadas para um exemplo e confira com o autograd do PyTorch."
        },
        {
          "title": "Tokens e custo equivalente",
          "task": "Conte os tokens de mil mensagens de 300 palavras e estime quanto custariam em três APIs pagas, pela tabela pública de preços."
        },
        {
          "title": "Explique para alguém",
          "task": "Escreva uma página explicando atenção para um dev que nunca estudou ML, sem fórmulas."
        }
      ],
      "project": {
        "title": "Mini GPT em português",
        "brief": "Treinar um modelo de linguagem pequeno, por caracteres, num corpus em português de domínio público e inspecionar o que ele aprendeu.",
        "requirements": [
          "Corpus limpo de domínio público, como as obras de Machado de Assis",
          "Tokenizador por caracteres e divisão entre treino e validação",
          "Transformer pequeno treinado em PyTorch, na GPU local, na CPU ou no Colab gratuito",
          "Geração de texto com temperatura e top-p configuráveis",
          "Gráfico da perda de treino e de validação"
        ],
        "doneCriteria": [
          "Perda de validação caindo, sem overfitting evidente",
          "Texto gerado com palavras e pontuação plausíveis",
          "README explicando arquitetura, hiperparâmetros e resultados"
        ]
      },
      "selfCheck": [
        "Por que a similaridade de cosseno funciona para comparar textos?",
        "O que muda na resposta quando você sobe a temperatura?",
        "Das falhas que você registrou, quantas eram culpa do contexto e quantas do modelo?"
      ],
      "resources": [
        {
          "type": "udemy",
          "label": "Matemática para Machine Learning (com Transformers) (Michel Janos) · nota 4,8 · 17 h",
          "url": "https://www.udemy.com/course/matematica-para-machine-learning/"
        },
        {
          "type": "udemy",
          "label": "Deep Learning de A a Z com PyTorch e Python (Jones Granatyr) · nota 4,7 · até redes neurais",
          "url": "https://www.udemy.com/course/formacao-deep-learning-pytorch-python/"
        },
        {
          "type": "vídeo",
          "label": "Neural Networks: Zero to Hero (Karpathy)",
          "url": "https://karpathy.ai/zero-to-hero.html"
        },
        {
          "type": "docs",
          "label": "Ollama",
          "url": "https://ollama.com"
        },
        {
          "type": "vídeo",
          "label": "Essência da álgebra linear (3Blue1Brown)",
          "url": "https://www.3blue1brown.com/topics/linear-algebra"
        },
        {
          "type": "artigo",
          "label": "The Illustrated Transformer",
          "url": "https://jalammar.github.io/illustrated-transformer/"
        },
        {
          "type": "paper",
          "label": "Attention Is All You Need",
          "url": "https://arxiv.org/abs/1706.03762"
        }
      ]
    },
    {
      "id": "m2",
      "shortTitle": "RAG",
      "title": "RAG: respostas a partir de documentos",
      "kind": "standard",
      "months": 2,
      "prerequisite": "Módulo 1, principalmente vetores e similaridade. Noções de SQL.",
      "goal": "Construir um assistente que responde com base em documentos, cita a fonte e admite quando não sabe.",